,text,risk_of_suicide,sentiment,magnitude,joy,sadness,anger,fear,surprise
213,"Hi, i never really saw myself doing this so it feels kinda weird to do.Since i was little i was left by both my mom and my dad.My dad left when he heard my mom was pregnant and my mom didn't wanted to take care of me so i had to live with my grandparents. I lived with (Only) them 7 years.Ever since that i always noticed things were not okay. Even when i was really small i was self-conscious of what was happening around me, i knew i did not had a dad, i knew my mom was mean (she would visit every now and then) and i knew my grandparents were just petting with me, treating me as a pet 'cause i was little, not because they actually liked me or wanted to spend time with me.Then things got better, we moved to a better house (An apartment) , my mom came back, i was happy for a little bit, that was until my mom left to live with one of her boyfriends, they would visit, when they were both drunk, and things like that, i remember once they took me to mcdonalds, when i came back i went to my room to show my mom one of my toys and when i came back she had already left with her boyfriend, she ran away from me.The same christmas of that year, i put a chemistry kit on my list, when it came i was super excited and happy, it was like my biggest wish, her boyfriend saw i was super happy and that my mom wasn't even paying attention to me and he said; i think i'm gonna leave, and my mom got mad at me she said i wish you were never born and she ran with him.Again, i was alone.one more year passed and i would see my mom once every month or something like that.She had a fight with her boyfriend, he cheated on her and i found myself on the middle of a house full of fights between her and my grandma, police had to come to separate them like 5 times... At that point i was just questioning why, i would cry on my pillow, or just try to forget about the situation, but the beef would always get to me and they would get me involved in some sort of way, once my grandma was trying to trow a knife at my mom and i jumped to try to get in the middle of it, i couldn't stop it, fortunately it didn't hit her but it was very traumatic to see all of those things happen.I was always bad at paying attention, all of those things made me just daydream a lot or just develop lack of attention to most of things.Although that... I always wanted to learn, i liked it, i could always get used to most of things without having to study them, just by practicing.After that it was just constant fights, every day for the next 5 years.I wanted a good school?No, go to a bad one.I wanted a good computer so i could play games?No, go outsideI wanted to go outside with some friends to some cool place?Nop, too expensiveI got to the point where my mom just sent me to a saturday highschool saying we can't afford a regular one aaand then she would buy fancy boots and clothes and go out, and everything, at that point i had to buy clothes from garage sells and she would get hers at the fanciest places at mall. I was always alone, i never talked to them since i didn't really felt comfortableThey would always treat me bad, make fun of me for saying an explanation, they would talk 'about a certain topic, and i would say oh yeah, it works like that, and they would say; no it works like this (nonsense) and they would make fun of me for getting the right answer, sometimes they would say is there something you don't know? mocking me and telling me to shut up.I tried different things, to accept my life, to just try to be like them, not to talk to them, everything... I just couldn't do anything.Right now i'm working and on college.And my mom wins x20 as me.I told her i needed help with college and i wanted to move somewhere else, since mxico does not have the best colleges and is not the safest place. She's just staying here because of some mxican guy she likes, sad thing is she doesn't even know him, it's a whatsapp boyfriend she met at some bad group of her work, he lives 12 hours away and he's cheat on her twice with her knowing 'about it. I tried to explain i always accepted everything and never complained, but i just needed help to find a better college; and she told me: No, stop telling me what to do, leave me live my life, i tried, i told her how i felt, how i wanted to get out of this country and she would just make fake jiggles, at some point i just couldn't contain myself, i was crying, i was not letting her get out of the door since she always does the same, she walks away and ignores me. she was pushing me and telling me i was crazy and worthless putting her face like 5 cms away from mine it's your problem, it's your problem then i said i'm your son, please help me you can't put a guy you just met 6 months ago before meand she jiggled hard on purpose, i got carried away and i did the movement of pushing her face away but did not touch her, she did a suprise noise and she was gonna start fake cry like she always does (she did that when she used to fight her mom numerous times) but then she noticed i didn't touch her so she did a dumb face and she keep repeating the same. The feeling of her trying to make me feel bad by fake crying, lying to me, laughing about her ruining my life just got me really mad, and i pushed (again not hit)  her face away, she did this horrible fake cry again and played offended for a bit, then afterwards she ran to her mom and dad's (Oh yeah, she's too bussy drinking and buying gucci boots to buy her own house) And she started telling her mom he hit me, he punches womans, he's so mean when all i wanted was her not to say those things in front of my face 'cause they were really really hurting me.3 days before this happened my grandma almost died, she drank a lot of pills, i had to break the door and go through a bathroom window to save her, when they came home they were acting like if nothing was happening, and my grandpa did not wanted to take them to the hospital, i got mad because it was a bad scenario, she was super bad, and he told me something like shut the fuck up you dumb shit I replied with What are you gonna do if i dont? he tried to scare me but as he saw i was not scared he said ok, remember this He's been treating me even worse than he used to.When this happened he came and told me to get out of his house, and that i was a worthless idiot.And now i feel bad and guilty because of that, because i would never ever solve problems with violence, i feel like the worst piece of human being.i just don't know what to do anymore, i've always felt bad 'bout my life,but i've always had hope on one time i'll go to college and i'll make my family proud but they don't even want to help me with that, i can't afford a private college on my own, and public colleges on here don't really give you much, i'm not learing anything and it's only valid on mxico,plus paying for transport is not that cheap on here, i can't even afford food. I've never talk about everything from the past with anyone, there's more, a lot more, but i just don't want to spend 3 hours trying to explain... I've always had hope, but now... I don't even know anymore, i don't see a good thing at all.sorry if my grammar is bad, i was still super shaky and nervous 'bout the situation.",1,-0.600000024,11,0.031271357,0.446708411,0.422709703,0.09011399,0.009196493
214,"So first, I probably wont leave this for long. Like an idiot, Im doing this from my main because Im to depressed and tired/lazy to use an alt on mobile.So a few basics for backstory. My relationship recently got downgraded to its complicated thanks to my brother and sister-in-Law and I cant see her for 2 years. My business is having trouble finding funding (we are making a video game) and its purely because I just dont have the skill or knowledge to get it. And I wont have the money to pay the bills next month because Im an idiot who likes to spend money.I also have no friends who I can talk to anymore. And my gf cant/wont talk to me because she cant/her depression is worse than mine. I talk to my employees, but after so long, they get tired of me or I really just cant tell them stuff. (its hard to tell them their boss is extra depressed and lonely today and thats why Im not responding fast)Someone help me and sorry for the wall of text! T-T",1,-0.400000006,3.700000048,0.063107528,0.575014353,0.182967156,0.130223483,0.048687533
215,"I thought this was normal: being sad is, having no energy, not wanting to talk to anyone, loving to stay in bed and sleep all day, skipping class and lying for it to not seem you're uninterested. Not until I got therapy and been honest with the people around me. I felt better. I felt like I wasn't alone. I was going to school again, socializing. I was happy. I couldn't that is what life is supposed to feel like. A week ago, I got my diagnosis. I had major depressive disorder. It was real. I sort of felt relieved. But it came again, I slept at 5 am again. Skipped classes. Didn't talk to people, but isn't as bad as before. I'm terrified of relapsing. I'm tired of getting used to this. ",1,0,4.699999809,0.022274457,0.594055474,0.301012039,0.062714145,0.019943928
216,"For the past year, all I've wanted is to have a friend who truly cares about me, and I finally have one that I know cares. But even with talking to them on a daily basis I still feel lonely. I still cry myself to sleep some nights being lonely. Why do I have to be like this, I don't know what else to do.",1,0.300000012,2.700000048,0.028655756,0.28862685,0.563271701,0.100428261,0.019017451
217,"It seems I've been dealing with this shit my whole life and only recently have I began to see what is going on with me. It felt normal, it felt like who I was. Guess what though, it's not normal, its not me. I'm so god damn sick of feeling like absolute dog shit, day in and day out. Nothing ever seems to go my way and all I've done is blame myself for being such a piece of no good little shit. But its not me. This isnt me. At first I thought everyone felt the same way about themselves, as if this is just the way things go. I'm so sick of it, I really really am. I just want it to stop. I want it all to just stop, but nothing ever does. If I had any quick way to end it all, I wouldn't be here writing this.It's funny though isn't it? Everyone asks if you're okay but no one ever wants you to say ""Hey, you know what? No, I'm not okay, I'm actually pretty damn NOT okay right now."" No one ever really cares. It's so easy to just hide away from all that, give a little smile every once in a while, a little Ha Ha at some not so funny joke and everyone just assumes you're completely fine. At some point though the smiles and the Ha Ha's stop because its pointless. It's all pointless. Nothing ever really matters. I don't know what to do with my life anymore. Whatever interests I've had have all just vanished like the people who kept asking if I'm okay. I don't even have the desire to plan ahead because I honestly don't think I'm gonna make it as far as some people think. They keep saying that it'll be better out of school and when you're out in the real world and all that jazz. Will it though? Will it really be better? I have my doubts, you know why I have doubts? Because I don't even wanna go long enough to find out if it will be better. I just don't CARE. I can't wake up in the morning and suddenly choose to give a single flying fuck if anything will be better. I just want it to stop. The only thing that's stopping me is the little voice in my head, that's getting quieter and quieter, telling me that this isn't me. This is not normal. You are not okay. But its fading and I'm getting pretty scared.",1,-0.200000003,12.19999981,0.039987568,0.392614305,0.458925515,0.0970404,0.011432259
218,"Its getting to the point where im starting to troll on reddit. Why? Because im bored and angry. I hate this. Everyday im just becoming a shittier and shittier human being. I can tell. I havent drank since my graduation back in may and now look at me. Drunk. Im literally begging to die every single day. I curse Gods name in the hopes that he just takes me. All the money in my bank account cant buy me style, it cant buy me a loving girlfriend, and it cant buy me any sense of self worth. Fuck my job. This is how im spending my Friday night. Wallowing in self pity. Im hesitating to drink more because i know im going to vomit in my sleep and my moms going to figure out what i was doing. Im too old for this.",1,-0.200000003,5.900000095,0.082437575,0.460391939,0.351098895,0.077704974,0.02836664
219,"Lost all my old friends due to mental illness. Finally made a friend a few weeks ago but they are super busy all the time so idk what to do. Recently hung out with an old ""friend"" and just listened to him complain about his tinder matches (he gets a lot mind you).I don't have the energy to go to events to meet people (thats how I met the friend) anymore. It just seems so pointless despite remembering how good it felt.",1,0,2,0.063952424,0.367045581,0.204123125,0.193687618,0.17119123
220,"At this point, I just have to laugh at the situation. It's good comedy. Someone's having a good fucking laugh up there.As may be the case with some of you, depression makes me extremely cognitively slow whilst at work. I do this thing where I sort of zone out when I'm forced to endure something I hate. I appear to be present to everyone around me, but consciously I'm really only half-there. I daydream. I've done it my whole life. I can't help it - it's as if it's an automatic defence mechanism. Through school and college and all of the jobs I've had, this has caused me problems.Now, as a 24-year-old man, I'm working as a waiter in a hotel restaurant. I haven't been there long and I don't plan to stay. I don't get on with anyone. All of the staff are quite a bit younger than I am and do not want anything to do with me. I have no self-esteem and I'm absolutely terrified of social interaction. I can't do anything to change it, so I just have to accept it. It's not how I want to be, but that's how it is. I keep my head down, and I don't bother anyone and I get treat like shit in return. I try my best to be content with that, but honestly, it's fucking awful.Very recently, this girl began to focus on me a little bit. It started with her just getting in my face and saying ""hiya"" in a stupid tone, in a blatant attempt to make me feel uncomfortable in front of the other staff. I don't know how to react to that. It did make me uncomfortable. Everyone's looking at me and expecting something back, but I just can't produce anything. I stand there and take it and desperately try to make it appear to have had no effect.Now it's at the point where she'll openly mock me in a room full of people whilst they all laugh. It's relentless. She'll tell people how slow and boring I am. I'll be called a ""fucking retard"" multiple times a day, she'll throw food in my hair and I'm pretty sure one time she spat in my lunch. It might sound like playful work banter, but it's not. And now a few others are joining in.With no one else to talk to, I told my mum about what was happening. It wasn't an easy conversation to have, and she couldn't decide whether or not I was being serious. ""So, a seventeen-year-old-girl is giving you shit at work? There must be something else the matter with you, that can't be it.""She seems to think that the bottom line of my problem is my ego. She says that only an ego is bruised by what people say. ""Ignore your ego, and you'll be fine.""To be honest, she's right. If I had no ego, none of this would bother me. Maybe I should just accept that I'm a little bitch who's terrified of talking to people. A man with nothing going for himself. Someone who'll never meet anyone, never have kids, and never be content with his life. Someone who deserves all of the shit that other people give him. Maybe that's who I am, and who I'll be until the day I die. If I accept that then none of this will hurt anymore.Sounds like a plan?",1,-0.300000012,18.39999962,0.084731408,0.545082152,0.185223669,0.131659627,0.053303145
221,"From start i would like to say sorry for my english its not my native language, and i really wanted to share my story to anyone.I have been suffering from depression for 5years now if not more. It all started when girl rejected me and i fall apart and givedup on my life, i just don't want to live since then. When i see couples holding hand i just start crying and something hurts inside me and i think in my mind ""This guy, what a life, what he done he lives it like it, he must be living a dream""(I'm a man to be exact 22) I never had any close relationship i have no friends not a single one to meet and spend time with. I don't leave my home to prevent seeing coupes kissing hugging and all this lovely unbelivelbly stuff. I can't sleep at nights i all the time go to sleep at 12PM and actually fall asleep at 4-5AM, in these hours i keep thinking how shitty my life is,none cares about it parents dont give a fuck even tho they know about that i have it. Now about the nights, i keep thinking about how wonderful it would be to have a girl to hold Her hands, to kiss Her, to talk to Her spend my whole life with Her give it to Her all of it, love as none else can, cry from happiness everytime i see Her, and most importantly hugs, thats my biggest dream of them all, to feel Her, Her body someone else touching me, actually feeling that i exist, someone do fucking care about me in this world i would hug Her deeply with pure love without faking it at all, then i sqeeze in my bed crying out loud and hugging my cover really hard like its Her. My dear love i will never have. Why? every time i see a girl i think 3 ways, either she must be in relationship already its worthless to try talk to Her, other way; Oh my She's so pretty and i keep staring at Her deeply with my ""love stare"" and they usually stare as well and it usually ends becouse of bus stops or something, last one, the worse of them all, at the beginning i already think ""Nah, she will reject me anyway im worthless and shit, not even worth a try"" Here is my story, deep down inside i have that feeling that a Girl that would love me as much as i love Her would cure my depression. Any thoughts? Should i even post this garbage here? ",1,-0.100000001,6.900000095,0.056906067,0.234994292,0.524903655,0.167516321,0.015679678
222,"Bringing myself to do anything is hard as fuckThen when I finish a task I don't feel any betterYeah, fuck...",1,-0.5,0.5,0.061737079,0.321504414,0.37091127,0.214311212,0.031535998
223,"What I mean by this is, I do plan on trying to get better... but only IF this thing happens to me first and the thing that needs to happen is not very likely to happen. And I can't make myself do this any differently. I'd start taking better care of myself, I'll start cooperating with my therapist, I'll start helping around the house, I'll start making an overall attempt at getting myself to a healthy state so I can live on my own, but again.. I can't get myself to do any of this, unless something happens first. And that something has a 99% chance of not happening. I know people will say, just to do these things before hand whether or not this thing happens, but like I said before.. I can't get myself to do any of it unless it does happen. I have a huge headache, and it's hard to think. That and i'm overall just slow in the head. So this might not make any sense whatsoever but bleh. I need help. Living in pain all day is killing me inside and out.  ",1,-0.400000006,5.199999809,0.064174272,0.325549424,0.249185234,0.352927446,0.008163586
224,"Some days I'll feel nothing, like a stone in a steam. Everything is moving around me but I'm just sitting there unmoved unfeeling.But then some days I'll feel like I can't handle anything, I can't breathe, I'm worthless, why do I bother.. I'm a fucking loser I can't do anything.Its those days I realize how much better it is to feel nothing, because I'm feeling now and I'm having to hold back tears just because of how depressed I am.I wanna be happy and stand straight, but I don't have the energy. I can barely move. I'm exhausted, physically and emotionally.What am I supposed to do??I'm never happy, the closest I am is feeling nothing.Please, tell me what to do. ",1,-0.600000024,3.299999952,0.107077092,0.265663922,0.134617344,0.472945482,0.019696228
225,"So I've been struggling on and off for a number of years with my mental health, generally this manifests in me eating and drinking too much, isolating myself when anxiety is particularly bad but on the whole I feel I mask things well and get on with it (I know this isn't heathy either). I have quite a responsible job, I manage people and deal with quite complex issues, it can be quite stressful. I've had a number of issues in my personal life over the years, I've been sexually assaulted amongst other things that aren't easy to deal with. I'm very close to my family and my mother has been sick with cancer over the last 18 months, we thought she was getting better after treatment but this week we found out the treatment hadn't worked so things aren't great.Apologies for the huge spiel above, the reason for posting is I feel I have hit breaking point. Yesterday with the stress around my mother I found myself driving on the wrong side of the road, I only moved over when a car was coming towards me, it wasn't intentional I was just suddenly, weirdly confused. Last night I reached a point I was just scratching at my hand to feel pain and want to do that now again. I have been prescribed sertraline before but been reluctant to take it, Inthink I'm going to give it another go. I'm sorry for this huge moan, I guess I want to know if others have done this, just want to be in bed, getting dangerously confused (me driving on the wrong side of the road) and wanting to cause myself pain (the scratching of my hand). Am I badly depressed? Anxious? Sorry.",1,-0.300000012,4.199999809,0.062144622,0.333102405,0.342828959,0.209319562,0.052604392
226,"My doctor recommended therapy in addition to antidepressants, but a) I don't think it's really doable right now financially, and b) I'm not sure what good it would do anyway compared to the antidepressants. What can a therapist really do for me if there's no clear cause to my depression? No trauma or anything to work through? What's the point of paying to go talk to a stranger if there's nothing for them to pick apart and ""cure?""",1,-0.100000001,2.400000095,0.018066041,0.171538383,0.691507459,0.077777162,0.041110851
227,'You are not a problem. You don't need to be fixed. You don't need to be 'solved'',1,0,0.300000012,0.039602235,0.742096067,0.173438013,0.041239992,0.003623684
228,I've stopped trying to get close to anybody around me because I don't know how to explain why I have literally nobody in my life without coming across as a depressing lonely fuck so I just accept my solitude and embrace it now. ,1,-0.600000024,0.600000024,0.044089429,0.148452058,0.098803073,0.702509046,0.006146413
229,"I'm 19 and I started balding when I was around 18. It made me very depressed and disappointed due to the fact that it made me feel like it's wasting my youth. I used to be really happy because I didn't care about how I looked. Ever since I started balding, I began to look and examine my other imperfections very deeply. I started noticing that I have a weak jawline, a slightly big nose, and my lack of tall height (5'8). This obsession of not being able to stop thinking about my imperfections has made me insecure, which is now even giving me social anxiety. Whenever I walk around school, I start thinking about what other people think about me. It's really annoying because I start walking very weird when I have anxiety and it's quite embarrassing.I feel like I lost all of my social skills. Whenever a stranger approaches me and start talking to me, I start getting very nervous and my heart starts beating, and I usually respond with a very stupid answer that shows that I have anxiety.So how can I stop being so insecure? I'd like to beleive that I'm at least a 5.5 - 6/10 but my brain is telling me that being a 5.5 - 6/10 is not even good enough. I just wanna end this social anxiety and insecurity. I take so many videos of myself every day and start looking at my imperfections.I also started browsing r/truerateme and it made me feel like shitSo what can I do to stop being an insecure beta fuck with social anxiety?  ",1,-0.200000003,4.599999905,0.032757063,0.524763584,0.325075567,0.097188041,0.020215754
