,text,risk_of_suicide,sentiment,magnitude,joy,sadness,anger,fear,surprise
136,"I know that rats, even pet rats, are a bit of an acquired taste, but I love their mammoth-sized personalities contained in a pint sized rodent body so please have an open mind if you choose to check out the video I want to share with you all. Rats don't live very long (2-3 years is the average in the UK), but they have a habit of forming a close bond with their owners which they later break when they pass on. We choose to rescue two rats, and I'm determined to make their short little lives full of adventure. They don't know what halloween is, but they sure enjoyed exploring the haunted mansion I made for them out of cardboard (featured as a background prop in the video.)After we had some leftover pumpkin; I had planned on just giving it to them for their dinner when I remembered a hamster-friendly pumpkin pie recipe I'd found on youtube. So there I was, mixing flour and peanut butter and rolling it into a pie shape, filling it with some mashed pumpkin then using a chopstick to stab a smiley face into the top (they're fearless, there was no point in a spooky face). I baked it and once cooled offered it to the ratties as a treat during their free range time.They loved it and kept trying to steal it from me; I've never had to wrestle food from my girl, Nova, so much! I hope, if not this story, then at least the video will also make you smile - and maybe make a pumpkin pie for your pet rodent next halloween so we can share videos together xhttps://youtu.be/cWSNn8dB04Y",0,0,2.400000095,0.734152794,0.095512196,0.023691289,0.013989399,0.132654309
137,"But at least I can smile once in awhile when I come to this sub, seeing you people happy does make me happy <3~",0,0.699999988,0.699999988,0.069876507,0.306147635,0.348320276,0.211921245,0.063734293
138,"So pumped! One and only math class I had to take! I was stressing big time cause I suck at math, but I pulled through! ",0,0,0.800000012,0.876032412,0.010800148,0.005788003,0.020784814,0.086594626
139,"A little over 2 years clean and sober, and Got a pretty sweet gig at the moment, and I'm starting to have a happy smirk on my face. Slowly but surely, I'm crawling out of the 'Eeyore Zone.'Have a great day everybody! :)",0,0.899999976,1.799999952,0.250154883,0.329711914,0.095724568,0.118399434,0.206009165
140,"Not interested in going into detail here since its the opposite of happy (you can check my recent post history), but the communities Ive reached out to for support have been nothing but amazing. Reddit may get a lot of shit for the actions of some subreddits and redditors, but overall, yall are awesome. edit: grammar",0,0.200000003,1.200000048,0.5044173,0.134559229,0.020649457,0.201717496,0.138656497
141,I posted yesterday about suicide and feeling like shit for the last 7 years. Yesterday I was happy. Today I am happy. Cheers everyone and I hope everyone reading this has a great day,0,0.400000006,2.799999952,0.354395509,0.384847701,0.107306793,0.067955062,0.085494876
142,"The last two years have been so insanely good, and it feels important to take stock in it and do some appreciating of it. Two years ago I married my internet friend of eight years and moved to Europe. I've made friends, I'm learning the language, my husband and I have a full and loving relationship! I absolutely love and appreciate this new country, and I make sure to think about that every day on my way to school, which I get paid for going to. I was overweight while living in the US, and had gained 10 more lbs since being in Europe. I got really really sick of it, I lost 60 lbs in 6 months and I've never felt better about myself! I'm this new woman whose bras fit and thighs don't rub!I got a contract with a global shoe company for proofreading! It's so so exciting to get working and contribute a bit more to our bank account!AND the icing on the cake is the most recent good news! The same shoe company asked me to do a few drawings for the next journal set to come out. I did a watercolor of the plant they were looking for and it got the green light! My watercolor will have its own full page in a magazine translated into 17 languages with a run of more than 100,000 going all over the world! When I got the news I started laugh crying so hard I almost couldn't breathe. I've never had so much exposure for anything, I'm still gushing with happiness and gratitude! Things are just going so well, and I don't even wanna complain a little!",0,0.300000012,4.400000095,0.202076525,0.278775632,0.162909687,0.270465761,0.085772403
143,"I'm 23 and I have NEVER run a mile without stopping in my entire life. I'm on the fifth week of the Couch to 5K which requires you to run 20 minutes without stopping. I actually totaled 1.8 miles in 20 mins, so an 11 minute pace. I'm over the moon!! Never in my life did i think i would be able to do this. I'm so excited for next week to keep training and run even farther!! ",0,0.100000001,1.600000024,0.940813065,0.002934981,0.000858574,0.005157589,0.050235752
144,"I was in a semi toxic relationship for over three years and I just finally had the confidence to put myself back out there. I met this girl who is amazing and we have been on a few dates and have finally made it official. After so long, I am finally happy again :D",0,0.899999976,2.700000048,0.317659706,0.290988028,0.040906057,0.257172346,0.093273908
145,"Today is the first day in 7 years of depression and depersonalization that I can say I'm happy I never killed myself. It's been on my mind for ages, and I've always asked myself if I'm glad I never did it. The answer was always ""no"". Today I'm glad I never went through with it. I want my life to get better and look up.I've struggled with DPDR, anxiety, depression, insecurities, and suicidal thoughts since I was 13. Today, I'm happy. Cheers everyone.",0,0,2.700000048,0.465343267,0.033403061,0.018521994,0.457149625,0.025582019
146,"In 2014 I dated a guy for about 10 months. The reason we broke up seemed so silly in hindsight; it was something we could've easily worked through it together. He was such a good guy, we really clicked on a personal level and I always regretted the relationship ending. A month or two ago, I found out through a friend that he was single. Today I worked up the courage to text him out of the blue and ask him to go for a coffee date - and he said YES!I don't want to get too far head of myself, but I'm just so happy that I get to see him again and catch up. We're meeting up on Sunday - wish me luck! :)",0,0,2.400000095,0.337324739,0.30693838,0.104746714,0.090669066,0.160321116
147,"I've been on Facebook since I was 12. It just used to be a way for me to play games while not contaminating my mom's Facebook.Then over the years it involved into something I was always on. Dependent on even. It was quite scary how much time I spent on that site. I turn 20 in a month, and I've been very reflective lately with how I want to welcome my new decade of life, and I realized that I want to welcome it with happiness, and peace within myself, and I wasn't getting that by being attached to Facebook 24/7. I was more stressed than anything. Now I feel free and peaceful and truly happy. I've set out to try new hobbies, get creative again, read more often, do photography again. Hobbies and things I used to enjoy that got sucked away from all the time I spent on Facebook. Just my little ramble. (I got rid of snapchat too, I hated that app) ",0,0.100000001,5.199999809,0.103799358,0.233966693,0.077798501,0.057824694,0.526610732
148,"Seven years ago, back in high school, I would normally draw or paint for people: portraits mostly. And usually for people that I admired or liked.That year, I had made a painting for a high school crush/friend for Christmas. It was a painting of a giraffe (a nickname she would sometimes call herself), on a yellow background (her favourite colour), and walking on a rainbow floor. Inside the frame I had written a lengthy note about our friendship. One that I considered would never actually be read, but at the time I felt it was necessary to add. To be completely honest, I can not recall a single word of what I wrote those many years ago.We haven't spoken to each other for seven years, but still were facebook friends and followed each other on instagram. I can't say if the note was ever read. But tonight she posted a picture of her room on instagram, and in the background was the painting. I would have expected her to have thrown it out by now, since we haven't spoken in seven years. But knowing the fact that she actually kept it for so long without us being part of each other's lives for seven years makes me very happy. It just made me feel nice to know that I might have positively affected someone else's life, or that she actually appreciated the painting enough to have kept it.",0,0.200000003,3.299999952,0.16014567,0.118344247,0.398248732,0.250582576,0.072678775
149,"That song put me in such a killer mood, everyone I saw was in a good mood and I aced my midterm exam for a difficult class. Hell yeah!",0,0.5,1,0.183417052,0.302670598,0.10921178,0.334688723,0.070011906
150,"My wife has struggled with depression and had a mental breakdown complete with suicidal thoughts at the beginning of the year. To hear her giggle in her sleep, I at least know that in that instant her thoughts and mind are in a joyful place. ",0,0.100000001,1.5,0.068545491,0.622355223,0.143478811,0.11433591,0.051284563
151,"Lately our puppy seems like she knows I'm having nightmares. She comes up in the morning to snuggle with me and my fiance, but in the mornings after he leaves for work I've been having a lot of bad dreams lately. The past few of them, the puppy has been snuggling so close to me I think trying to wake me up, like she's cuddling me back to comfort. I want to cry with how sweet this dog is. I've had plenty of dogs my whole life but none have ever been so intuitive as she is.",0,0.400000006,2.599999905,0.621322095,0.165714681,0.039617114,0.122581378,0.050764676
152,"I've been so overworked and had the worst week. My boyfriend decided to come visit me (lives 6 hours away) and I literally can't wait to see his face. I think we might watch Hulu all weekend and cook pasta, but it sounds perfect. The weekend is almost here!",0,0.200000003,2.599999905,0.666178525,0.034748793,0.02417369,0.199201465,0.075697504
153,"I was told as soon as I started university that it was impossible to find relevant biology co-op jobs and that I was basically screwed. Having zero past experience in a lab setting and this being my first work term, I had all but accepted that I was going to end up unemployed this winter. Well, after 3 stressful interviews with different companies, offers went out today and I ended up receiving an offer for my first choice job (out of over 100 applicants)!! I get to work in a lab as a research assistant and learn about all sorts of molecular biology techniques and help conduct research that matters in a field I'm really interested in! This is such a weight off my chest and I'm so excited to start working :)",0,0,3.400000095,0.155421555,0.18310079,0.07836403,0.500679731,0.082433865
154,"So, I'm a college student taking Chinese along with the rest of my engineering classes. All my classes are tough, but Chinese goes fast. Really fast. We learn about 20 to 40 characters a week and are tested often. To keep up, I regularly put in half an hour to an hour and a half a day, partly to keep up and partly because I enjoy it.I went to talk to the professor about continuing classes in Mandarin, he told me that I was a good student, that he could see I put in the time, and that he was disappointed at times when he could see most of the students just shrugged it off as a humanities credit. For reference, this teacher never does anything but smile, he's the happiest person I know.For him to have noticed me in particular just made my week. It's wonderful, both to know my work isn't in vain, and to slowly be able to puzzle out basic Chinese sentences.I hope this wasn't too bragging-y, this just brightened an otherwise rather dull week.",0,0.300000012,4.199999809,0.224775314,0.417646587,0.153850749,0.157053709,0.046673659
155,One of my best friend's awesome girlfriend had thier baby a few days ago. They had a previous miscarriage and we're both overjoyed at this pregnancy. Mama felt something was wrong and went to the hospital and saved her baby's life as something was seriously wrong. One more day or so and it would been a different story.I'm so freaking happy for them ,0,0.5,3.299999952,0.451984793,0.107101291,0.044164106,0.386368305,0.010381494
156,I am beyond happy. I have stressed for months over college applications and finally this morning at 1am I submitted my first application. Its early action but the road only gets easier from here since I have all the basics done. So now goodnight but man Im so happy. ,0,0.600000024,2.599999905,0.159992725,0.267958999,0.141177759,0.124894425,0.305976033
157,"I have been on tinder for a couple of years. I have gone through phases of usage with the app, usually a week or two of diligent swiping, but usually I go weeks without opening the app.A month or so ago I got a notification saying that a girl had super liked me. If readers are unaware, you swipe up for a super like, instead of the usual left and right. This happens more often as a mistake from exiting detailed views of users profiles, at least more often in my experience. I ignored this super like. That was a mistake. A few weeks later, I thought, what the hell, Ill give it shot, Im desperate. I sent her a message apologizing for not getting back to her sooner, and explaining that I dont check the app very often. To my astonishment, she actually replied and understood. It turns out she was a genuine super like. We started talking, and things progressed from there. I added her on Snapchat, and after talking on that, I got the nerve to ask for her number. She gave it to me without hesitation. We texted, and things went deeper.After two days of texting, I had had enough. I told her Im smitten with her, and if she wants me, Im hers. She said she does, and I couldnt be happier. Weve been texted all day everyday. The best part? Shes damn gorgeous and thinks Im handsome. Shes kind, sweet, and has a beautiful smile. The bad part? She lives three hours away. Some day we are going to meet in person, and that day is going to change my life. I love you Mariah. You mean the world to me. ",0,0,5,0.806603074,0.022463327,0.007771797,0.068014212,0.095147625
158,"We filmed this video almost exactly one year ago and have been waiting to share it with the world for the past six months. The day has finally arrived when I can shout it from the rooftops (of the Internet). Without further ado, may I proudly present [""The Fawn""](https://youtu.be/4oa-zTbwKMg) by Philadelphia-based experimental rock outfit Something Like A Monument :)",0,0.600000024,1.799999952,0.396226734,0.078434438,0.272831231,0.200071022,0.05243659
159,Hope you lovely people have a happy day too!,0,0.800000012,0.800000012,0.104692414,0.554166317,0.1628526,0.098173991,0.080114752
160,"Just studying away and hear a knock on the door and then garlic bread in my hands. He didn't even owe me anything and we only really know each other through a friend. I'm not starving or particularly poor, I'm just really happy and felt like sharing.",0,0.100000001,2.099999905,0.114380203,0.188279137,0.21593529,0.427353829,0.054051541
161,"Theyre so cute and so polite (so far). I keep giving them so many sweets, fingers crossed I dont run out ",0,0.400000006,0.899999976,0.32897532,0.332382202,0.128695458,0.112632886,0.097314201
162,"Many swamps are quite beautiful, but filled with pesky bugs during the warmer months. After a few nights in the 40s, they seem to be gone for the season along the Carolina coast and I can enjoy water views like this https://imgur.com/a/TpcVh in peace.",0,0.200000003,0.600000024,0.208192617,0.332570911,0.155634284,0.095964059,0.207638055
163,Dad and I kind of just drifted over the years and I held some animosity toward him because of it. But weve been talking a lot lately - settled our differences - and are closer than ever. Im really happy about it ,0,0.600000024,1.799999952,0.078923859,0.190752208,0.020026479,0.100040399,0.610257149
164,"I didn't think it was possible after a series of terrible relationships, but I really feel happy about this. I would be okay even if it didn't go anywhere long term, but it's given me hope that someone out there exists for me. We seem to get along so well you could call it eerie. Everything seems to flow naturally from conversation to kissing. I asked him out expecting all the worst possibilities, but I never thought to consider what good could come out of it. I barely know the guy considering I met him in a random encounter. I don't know how to feel yet, but I feel a strength of spirit that I haven't in a long time thanks to this. I am more capable of overcoming my depression and anxiety easier thanks to this random blessing. I don't believe in any gods, but fate has given me a small present. Whatever it is I feel grateful. I am not used to being happy and this feels like a small miracle.",0,0.200000003,5.400000095,0.175997913,0.37566036,0.113873988,0.112577312,0.221890464
165,It wasn't cheap but I got to be home for the first time in 9 months to see her get married and I also saw my brother who I hadn't seen in almost a year and some other family members I haven't seen in even longer!,0,-0.200000003,0.200000003,0.253565162,0.39608258,0.065191791,0.093944974,0.191215545
166,"I had a long term crush on this good friend of mine. She's wicked smart, goal oriented, fun, and just absolutely beautiful. I've known her for a solid 4 years now, and I knew I was not her type based on the guys she's been with previously. I obviously did not want to make things weird between us since I would rather have a friendship with her than nothing at all, so I never said anything. Then, one night, when we were both getting drinks with friends, she kissed me! Ever since then, I could not be happier. I take my GRE next week, I'm in my last year of college, and super stressed every week, but I'm typing this as she's sleeping right next to me, so life is not as bad as it seems. She's my best friend and I love her ",0,0.5,5.599999905,0.448107362,0.258039892,0.065256916,0.082883388,0.145712435
167,"This was a few weeks ago, but I finally got around to watching all six ""Star Wars"" movies all the way through (I know there are seven now, but I'm talking about George Lucas's films). I saw them in chronological order, not release order--I started with Episode One and ended with Six. To me, it was more of a story about a family than anything, which I thought was wonderful. All these years I was led to believe that they were hardcore science films, the kind where emotion was scarcely visible and had to be scoured for, but I was so wrong. The conversation between Padme and Anakin in the end of Episode Three (you fans know what I'm talking about) made my heart ache; I had to take a break before I saw Episode Four. I'm just relieved I got to appreciate such an awesome movie series before I turned 20.",0,0,3.5,0.252168596,0.249456212,0.1734263,0.292309821,0.032639064
168,"I started trying to lose the weight in 2010 when I hit 468lbs.  I've fallen off the wagon many times but always got back on.  Today my official weigh-in was 350.2!  I've still got a long road ahead, but I'm feeling far better about myself then I have in a very long time.",0,0,1,0.744474053,0.055978719,0.006937095,0.097784385,0.094825774
169,"I never saw myself coming this far! I got married at a young age (19) and was happy, until a guy I worked with decided to go full creep and followed me home, threatened my life and really just.. did too much. My husband at the time couldn't handle any of it and left me, broken and scared. This was 6 years ago, for the past two years I've been with an amazing guy I met through Tinder (I know right? Thank goodness I got lucky) and I never imagined I would make it this far in life! I thought I could never be happy again after everything, and he's an insane blessing. I hope everyone is having a wonderful of day as I am <3 ",0,0.200000003,5.099999905,0.09928111,0.625703752,0.075822212,0.138764113,0.06042888
170,"For starters this happen very recently (last Tuesday to be exact). Im a flooring installer, I work for a subcontractor, and overall I have good weeks and bad ones. This week was the best I had ever made, I got paid (I get paid a percentage, so I get paid in cash, pay my own taxes at the end of the year as most people in my line of work are 1099 by the Subcontractor) on my way home from work I stopped by a grocery store gas station and grabbed milk for my kid and pumped gas.Apparently I either dropped my wallet from my pocket, or laid it in my car through the window and it fell out when I opened the door, really Im not sure. I left and didnt notice it was gone till about 30 minutes later when I went to pay a bill and the wallet wasnt in my pocket... at which I drove back to the store (about 15 mins down the road) and the attendant told me someone had turned in the wallet to lost and found... I checked lost and found, it wasnt there...I filed a police report, tried everything I could to find the wallet, waited at the store for 2 hours, when I get a phone call from a company we occasionally do flooring for, telling me this gentleman is trying to find me to turn in my wallet. When I meet with him the entire paycheck was in there.My current financial situation is grim, Im litterally living paycheck to paycheck (this week I made 250.00) if this gentleman decided to keep my money, Im not sure what I would have done, Im on the verge of getting evicted, it was my rent, and food, and gas for the week... This gentleman really saved me, Im not a religious person but Im really thankful that there are some good honest people out here still.",0,-0.200000003,3.400000095,0.252157331,0.358945429,0.172198758,0.113056451,0.103642047
171,"On top of that, my son went from failing in school to teetering  on honors, had my 4th anniversary with my dream girl (a non smoker) and getting this old body in shape is starting to happen. It's amazing how things change when you decide you've had enough of a life that's not working for you. ",0,0.5,1.100000024,0.401847631,0.2320894,0.099354088,0.248023093,0.018685753
