,text,risk_of_suicide,sentiment,magnitude,joy,sadness,anger,fear,surprise
0,"I'm 25, college grad, engineer, fiancee, 50k savings.I hate it all. Our life is just a constant grind. Work your ass off in school so you can go to ""good"" college. Work your ass off in college so you can find ""good"" job. Find a job and grind your life away there (and half of my friends are unemployed and with technical degrees, so pointless effort). All this effort is supposed to make you happy. It didnt work out for me, I never considered graduating and having a ""career"" a success.I am amazed how most of people can enjoy simple things (video games, football) without feeling that this world is a downward spiral.Am I depressed? What do I do?",1,-0.100000001,2.799999952,0.01468288,0.272604525,0.486469001,0.212975651,0.01326795
1,"Ive been having the worst time of my life these past months and in return, Ive been late on assignments. My parents know that Ive been dealing with really bad depression and anxiety lately and Ive told them the reason why my assignments are overdue. Its because Im too mentally drained and unmotivated to do it. I cant come up with anything to write because Im too focused on how bad everything is. They never ask me how Im doing, they ask me if Ive gotten any homework done yet. And I just cant take it anymore.",1,-0.5,3.200000048,0.006733741,0.489428222,0.444820404,0.053173635,0.005844004
2,Because when you fall back down again you remember how good you felt and how stupid you were for thinking that this depression might be over. It's never over ,1,-0.300000012,0.600000024,0.201177925,0.192353904,0.034518346,0.042072963,0.529876828
3,Yay I wasted a whole year of being alive!! This year was different though I got so high I couldn't feel nothing so I think it's fair to say it was the best birthday I ever had!,1,0.5,1.100000024,0.008008836,0.70366019,0.231973201,0.052192695,0.004165117
4,I have no friends. No one likes me. I hate myself because no one likes me. It's so painful to be all alone in this world. ,1,-0.600000024,2.400000095,0.049800199,0.180501476,0.687281966,0.072259769,0.010156569
5,"Literally, everything I've ever done has ended up being a failure. I've done nothing in my life that I can be proud of. I've achieved nothing in my life and I never will because I'm braindead and autistic. I seriously see no point in just being a constant fucking failure while literally everyone is so fucking happy and they're constantly succeeding. What the fuck did I do to live in such pain? Why do I deserve all this suffering?",1,-0.5,3.400000095,0.051444665,0.569158196,0.216701329,0.151319832,0.011375999
6,"I don't usually post these ""woe is me"" type post, but i'm tired. I'm tired to my bones, to the point i don't want to wake up anymore.I swear it feels like god has some personal hate toward me and does everything possible to make me suffer. Provides just enough occasional happiness so i don't get comfortable in my misery, something to take away and be missed. Everything good in my life fucks up in the end. Relationships, college, work, friends. I'm such a fuck up and a burdon. I'm anxious and socially awkward. I'll probably be alone for the rest of my shitty life, but i've come to accept that. Don't have the balls to kill myself, couldn't bear to push that pain off on my family and the few friends I have anyways. I just want to not be miserable, i don't want to be alone.",1,-0.200000003,4.400000095,0.026718505,0.777159154,0.133978069,0.041035846,0.021108374
7,"Found this quote in a book I read over Thanksgiving that describes it perfectly.The worst part of being truly alone is you think about all the times you wished that everyone would just leave you be. Then they do, and you are left being, and you turn out to be terrible company.It seems like regardless of being with others or alone the sadness is there.",1,-0.699999988,1.5,0.035380211,0.606366217,0.245636627,0.089211926,0.023405073
8,"My mum is losing it at me, but she does any time I show my depression, shed rather have me suffer in silence than actually having to help. The truth is, I just dont want to eat, Ive been sleeping all day so Im not hungry and it feels right to be this empty. Its only 2:30 ish so I may still have something but I dont want to. I like the pain of being hungry, it reminds me that I have something I need in life, even if thats just food.",1,0,1.200000048,0.027490176,0.262430072,0.417277247,0.287696183,0.005106272
9,"Really feeling out of it, like really dissociated.I cant live in the moment regardless of how exciting something is. Im constantly in my mind. - Conversations are really difficult to have.I sometimes forget other people live with me until I hear them and Im like oh shit I forgot you were here. Dreams often they feel more real than real life. - More vivid and meaningful.I just feel like my mind is elsewhere. I cant engage with anyone or anything, havent drove my car in about a week because I cant concentrate enough, just struggling with basics really.I need a solution...I hate feeling like this. ",1,0,3.099999905,0.050467774,0.477498353,0.137694925,0.313890964,0.020447943
10,My whole life I've been told that I'm smart. And I guess that's possible. But I have no other redeeming qualities. My depression and my anxiety just sap all of the energy that I might use for life things. I'm constantly tired but to the outside observer I just look lazy. My mind is too clouded to concentrate on doing anything well. It takes so much effort to deal with all the paperwork and money management of life. I can't find a job. I owe money to like four different hospitals because of all the times I went to the E.R. thinking I was dying from something that turned out to be a panic attack. I still live at home six years after I should've been on my own. I'm smart enough to write about the way I feel and express it to other people and spend hours dwelling on the state of my life. But I'm not strong enough for the other 99% of life. It's a lonely feeling. ,1,0.100000001,4.199999809,0.084977329,0.139498249,0.061615557,0.651177764,0.062731102
11,"Jesus. How do I even start. All of this is so obvious and yet for years I haven't been able to grasp what's been happening with me in the past 12 years (I'm now 22).I'll start with the context. I've been dealing with depressive thoughts and anxiety for a period of about 5 years now and haven't been able to pinpoint the exact reasons for why I felt about myself the way I did (yeah, the imfamous ""brain fog"").I managed to finish school with ""good enough"" grades and enroll at a nice university. I have been an alright student for the most part and been successful with all the exams/challenges that came my way. But in late 2015 (the last year of my bachelors programme) I started noticing that I was not actually satisfied with my education, in fact - I didn't even like most of the courses. That dissatisfaction had lead to me questioning whether or not I should continue the chosen academic path and whether a master's degree in that specialization was worth investing an additional 2 years into or not. At that time I thought to myself: ""Of course I should go on with my education, it's a no brainer!"". Well, things started getting really bad this year when the time for my dissertation to be written has finaly come. Oh, how much was I procrastinating while having no coherent idea of the subject for my thesis... This struggle made me wonder why it's so difficult for me to come up with good ideas and that's exactly when the revelation came.FAKE. Faking. I've been faking everything since age 11. My middle school education, my interest in university courses, ""friends"". Everything was fake.I'm yet to fully grasp all the details and circumstances of the moment I turned from being a clever, curios and inquisitive boy to someone who felt the need to fake everything. But I know for a fact that it all happened when I stopped hanging out with well-behaved kids and made friends with a kid who acted like a hooligan all the time. Oh well...It's kind of shameful to arrive at such conclusion when I'm a 22-year old guy but I guess better late than never. The new road is ahead of me and I'm both scared and intrigued...",1,-0.200000003,8,0.059545808,0.308778703,0.15530026,0.46081084,0.015564427
12,"Im 24 and I have no friends. I should be going out on weekends, dating and making lifelong memories like everyone else my age. Theres that strange gap between age 20 and 30 where everyone is either married with kids or single and getting smashed every weekend. My days are all the same and sometimes they all blur into one... work, sleep, eat, repeat. I spend 90% of my time alone and I dont know what its like to have someone I can trust. Someone I can talk to about the simplest things, laugh with and cry with. I have no passion. No motivation. But I do want to change. I want to be loved and I want to be needed by someone. Its hard when youve got nobody because you will never get invited places. Everyone around me has their life sorted already and they dont need a new friend. I lie about what I did on the weekend if someone ever asks and Im getting good at pretending. I get anxiety even thinking about breaking out of my daily routine that Ive created over the past few years. I dont even know where to begin. Home is my safe place. ",1,0,7,0.060098149,0.403004915,0.194876432,0.314510346,0.027510181
13,"I've tried to type out my feelings in here for more than an hour now. I can't even express how devoid of any meaning I feel. If I can't even express it, how am I ever gonna feel ok again",1,-0.200000003,0.899999976,0.183494434,0.480445534,0.101902477,0.099602521,0.134554982
14,"It's been over two and a half years since you last said you loved me. It's been just over two years since you last spoke to me. I've moved, changed jobs, travelled the country, made new friends, climbed mountains, had experiences I could once have only dreamed. Yet try as I might, I can't get you to leave me. A day, an afternoon, many times an hour can't go past without me thinking of you. Longing for you, your love, your companionship, your friendship. And that truly is what I miss most of all; I miss my best friend. You were everything I ever wanted in life, angel. Unfortunately for me, you still are. And knowing you will never even give me the time of day again is slowly killing me. It's a slower death than I first thought it'd be, I admit. I'm still here, after all. But I don't want to be. It's been so long since I've wanted to be alive I'm not really entirely sure I know what that feeling is like anymore. I'd trade everything for just an acknowledgement of my existence by you at this point. Everything I've done the last six or seven years or so has been for you, angel, that way somebody truly in love just exists. I wish I could turn that off. To move on. To stop loving a woman who will never love me. But it turns out, my thrive damned loyalty has a lot of experience staying loyal when things suck. Even when I don't want to. In all those terrible fanfics we love(d?) to read, eventually that loyalty would pay off and we'd get our happy ending. In reality, my love for you is a ghost that haunts my every step, reminding me every minute of every day at how close I came to nirvana. Of how of all people I was going to get my happily ever after. That we were going to be one of the lucky ones. How naive. All I want for Christmas is still you, angel. And it always will be. Whether I want it to be or not. I love you. ",1,0.100000001,10.19999981,0.024442595,0.583278418,0.303528845,0.083015159,0.005734964
15,"but I don't want to kill myself.I look around and I see so many awful things happening in the world, the most recent of which is the tax bill and I just can't. I feel so empty and sad and broken. This is an important year of my life, I am about to graduate from graduate school, for a fucking helping profession, and I can't even help myself. I don't feel qualified for pretty much any kind of job in my field. I don't know why anyone would hire me. I hate everything. There is no hope. Only the daily slog. I don't have intentions. Only desire. I would and could never do it. There are people in my life I love far more than I love myself, and for them I will keep going. But it just seems easier to stop. I'm just so tired of not feeling anything but hatred, sadness and anger. ",1,-0.300000012,7.900000095,0.062364616,0.204949141,0.469031274,0.139497638,0.124157354
16,"""Just be more positive, you're too negative about everything""""It'll get better later, just think about that""""Well change something if you're not happy""",1,-0.899999976,0.899999976,0.061209936,0.213844031,0.565017879,0.147798255,0.012129895
17,"to be able to work 8 hours per day ,to work hard and enjoy it, to not lay in bed for 3 hours cause i am still tired, to eat more than twice per dayi want to play computer games cause i love it, not as form of escapism. i want to enjoy music again, to be able to focus on things for more than 10 minutes, i want to communicate with human beings again. to maintain eye contact and other thingsi started to take my meds again and i know it will help, i just dont know if i will become anyhow normal again after those years",1,0.200000003,0.600000024,0.029411685,0.53878367,0.126322106,0.295617521,0.009865027
18,"I'm tired of being used. If I died, Everything will be fine. I don't want to be hurt anymore. I always try to fix things and make a good relationship but no one listens to me. maybe I'm not good enough. To anyone. If I had a gun, I wouldn't be here now. It's easy to kill myself by gun. But I don't have a gun. I did hung myself but I failed. I won't be here in next year.. I wish I wasn't born.. I wish I was dead.. I don't need future I don't need hope. I just want to forget everything which made me feel bad and my pain.. ",1,0,4.5,0.064521641,0.673272431,0.128042594,0.059209839,0.074953541
19,"(im not english, my grammar may be bad)So, i just have enough and want a little time off from everything. Insta, face, even dating sites. Im not the most popular person on earth but i wrote on facebook im going away, and i dont know if i will be back. Nobody cared am i all right, or if they miss me...nothing.I thought i had friends. I had a best freind who always whined and used me as an escape from reality. I had a social group (best friends group) but it was only a casual drinking circle. I dont drink that much so, they don invite me. If i dont go with them one time, they never call me again... and i have few casual small talk persons who writes me when they are bored and want to be entertained. Because im the entertaining one who likes the smiles.If i wanted to meet them, they always had ecuse.But i want more from people, from life.Im not ""jelly"" but sometimes im angry how others can succeed in life and im going nowhere. Know a person who guited his job, went roaming the world for half year, instantly got his job back and few days ago he found a girlfriend. My best friend who always whined about his problems and pushed it to me, even drunk his problems away, without effort solved all his problems and he is ok... and im trying and suffering and cant do sh..t in every field of my life. Sometimes i just cry ",1,0,6.199999809,0.042334698,0.167556316,0.230379909,0.528680027,0.031049047
20,I got no one to tell them goodnight. To anyone hope you sleep well,1,0,0.5,0.061712109,0.371594548,0.222621098,0.33622244,0.007849779
21,"I'm hopeless, lonely, stupid and all. I just got back from gym. I wanted to go to the gym hoping it would make me feel better because it used to but not anymore. I keep thinking about last summer. I was staying at my family house. There was nothing to worry, no feeling of loneliness and my anxiety got much better. I would sleep at like 11 and wake up at around 7, go to the gym and then have a breakfast with my mom. I was so happy and feeling confident. Now I'm in a different city for college. I never experienced something like this before. I'm feeling this way for like 2 months. I used to have some bad days but thats it. Now im so scared and anxious about my future thinking i will never get better and be the person i actually am. I'm a 20 yo male and i feel like wasting my young years and thinking this makes it even worse. Waking up is so hard these days, i miss the days i wake up feeling refreshed and radiant. Now i don't even want to look in the mirror. Only thing that would make me feel better is being with my mom but its not possible now. I can't even go to school for days. Many assignments i couldn't do. I don't know what to do. My life is going downhill and all i do is thinking about death. ",1,0,9.5,0.019096745,0.452088833,0.300201297,0.199263439,0.029349746
22,"Does anyone else ever get wrapped up in existential depressive thoughts? For example: If I died today, in 500 years, it would make no difference in the world whatsoever, I will be long gone, and everyone who would be saddened by my death would be long gone and forgotten. Why should I keep suffering if 1000 years from now I will be forgotten by even genealogists? Why should I keep living this shitty existence if I'm only a speck of dust in one tiny little instance of an infinite universe? I feel so helpless against this train of thought. Anyone else relate?",1,-0.300000012,2.200000048,0.006699755,0.334306926,0.633076668,0.024289811,0.001626859
23,"Am i the only one that gets frustrated because being able to read other people, and knowing when they dont care, or they want to go, or they are desperate to end the conversation, etc",1,-0.5,0.5,0.005190332,0.596283257,0.378771126,0.018904224,0.000850994
24,"I dont wanna live for others sake, just so they won't be sad when i'll kill myself.",1,-0.699999988,0.699999988,0.073940523,0.425250322,0.088892289,0.370677084,0.041239828
25,"Well, probably it isnt first one,but first official one. Had no idea what was going on, whole body started to shake, hand and head felt numb, called ambulance and went to the hospital. Spent night there was feeling well, doctors told me to go check heart later. Got home and it started again but i learnt how to control it.Almost week later after that, i feel really strange. It feels like i'm in a dream. Everything is boring, i can't even play my fav games as i just dont focus to them. I feel like i'm still sleeping, i also feel empty. I hope someone else felt like this before and could help me. I don't know if everything is like this because i have depression. I don't know if i do. Feels like it. But before when i was sad i could play,read books or such and feel better. Now i'm afraid to get out of my bed because it might start again. And it happens even if i'm in bed, yesterday before sleep my right arm started shaking randomly and i couldn't control it.  So, is it possible that my fear is somehow connected to depression and vice versa? Should i go to doctors again? (Was at heart doctors yesterday, said i'm fine,nerves doctor also said i'm fine). Should i go to psycho-something(lol) for the first time? I really don't know what to do anymore. Don't want to tell more about this to my parents as they would be afraid, don't want to write about this to my friend either:I Sorry for my bad english, hard to think about grammar when i'm feeling like this, and i'm also very sorry if this is wrong sub for this. Couldn't find any better one.",1,-0.100000001,7.199999809,0.436166883,0.238799721,0.065062352,0.199142888,0.060828157
26,"Hey there my depressed babes! I just wanted to share some hopeslowly Ive come out of the worst bout of depression Ive ever experienced, and I just want to encourage anyone who is going through it that it can and will get better, even if slowly. Sometimes we have to force ourselves to keep moving and then we get betterthats what happened to me. I lost my job, lost my apartment, had to move back in with my mom, and was a general wreck of disassociation and suicidal thoughts. Turns out I also had a B12 deficiency which can cause depression/anxiety. Found a new job, started taking vitamins, slowly got backinto a routine, and now Im fine. It was a weird time. I hope to never go back there; it scares the living shit out of me, but to those who are going through it, you are valuable and you do have purpose. Find something, anything, and do that. Gain your confidence back. Love love love you all.",1,0.100000001,5.5,0.049647976,0.647480726,0.119636297,0.141678795,0.041556191
27,"2017 has been the worst year of my life. Without a doubt. In the past year everyone who is important to me has broken my trust in one way or another, uncovering all the severe trust issues I thought I had moved past. People I thought I could truly trust. I had completely let my guard down, things were looking up. And now I am right back where I started years ago. I hate feeling like this. They were the only thing that helped feeling so depressed all the time. and now I dont have that. ",1,-0.100000001,3.299999952,0.051995665,0.646988273,0.176948816,0.102591276,0.021475995
28,"Hi everyone. First time poster. Trying not to internalize my emotions so much, and honestly, I need someone to listen.I've been diagnosed with depression since I was 13, and now that I'm 22 it's just gotten so much harder to handle. Normally I can handle myself and still stay productive, but over the last two years I've felt my grip on myself start to slip.For the past 3 days, it's been worse than it's been in years. I can't even talk to anybody I know about it because they don't understand what it's like. ""Just do something fun that'll make you happy"" and ""You need religion"" were two of the responses I've gotten so far when I try to reach out.I had a friend who understood, someone who has experienced it for himself, but last night I lashed out and now I think it's over between us. Whenever I get really depressed, I don't know how to handle myself. I can't afford meds or a therapist with my work and insurance now and I'm just really scared.Last night, for the first time since I was in high school, I seriously considered suicide. I managed to convince myself that I only had friends because they pitied me, and my family only kept in contact because they feel guilty. For the first time in a long time, I felt completely alone.Don't get me wrong. I enjoy life and all it has to offer, but last night, a switch was flipped and now all I can think of is the pros and cons of offing myself so I'm no longer on this crazy ride. Again, I really don't want to, but the thoughts are like thunder in my head.I must not be the only one who's been in this situation. How do you manage and keep your head above water when it feels like you're trapped under the ice?",1,-0.200000003,6,0.009187561,0.717625856,0.201197416,0.064610258,0.007378988
29,I feel like all my peers already have friends and I feel so lonely. What can I do? Should I get in touch with my old friends even tho I think they hated me and I pushed them away?,1,0.100000001,1.100000024,0.088470772,0.568518281,0.167965218,0.142541483,0.032504231
30,"I'm exhausted. Physically and mentally. Depression has been with me for most of my life. I ended up making big life changes to hopefully break out of it. Lost a ton of weight, moved to new area, found a job I enjoyed, and made friends. Yet, my depression is worse. I feel empty as ever.I used to have escapes. Being with family, movies, games, writing, music, going out, working out, etc. But, my depression is vampiric in the way that it sucks the enjoyment out of everything. One by one each have become joyless and chore like.  It feels as though depression finally won. It has consumed me. Broken me. And the worst part of it all is knowing that I'll always have this. I've never wanted to give up more.It has gotten to the point where all that is on my mind is suicidal thoughts and bullying myself. If I could just have one escape back it would be great. Even just being able to sit down to enjoy a video game instead of forcing myself to. I just want to escape the thinking. Just for a bit.",1,0,9,0.076585412,0.500603437,0.093033843,0.27320534,0.056571975
31,"Throw away because of anxiety Well, how should I say this? I've known this one guy for a while now and he's cute, funny, just a perfect type of person I'd wish to be in a relationship with.But let's skip right to the point alright?While I was playing monopoly with him along with our group of friends at his house (I also wanted to make a move on him tonight) so I decide to ask everyone where do they see themselves in the next 40+ years. Skipping again to him he spews this: ""Me? definitely not married with anyone, I'd rather be a success than have sex.""I feel rejected even though I wasn't even in a relationship with him. I get that crushes aren't always suppose to work out but this is going to be a long emotional trip on getting over him. I thought there was something between him and me ",1,0,2.099999905,0.08548972,0.543458462,0.092283696,0.213856474,0.064911716
