,text,risk_of_suicide,sentiment,magnitude,joy,sadness,anger,fear,surprise
384,"Was talking with my neighbor and the subject of suicide came up. I think she saw something in my eyes when the topic came up because she started going off about how suicide is stupid and how I should never kill myself. Am I really that obvious? And even if it's ""stupid"", it's my only way out of this hell I've created for myself. Haha just end me now (but i won't because I'm a coward).",1,-0.5,2.700000048,0.007402043,0.127489924,0.643260956,0.218282089,0.003564952
385,"I hope this doesnt come off sounding rude, because I dont mean it to, but I genuinely want to know how so many of you are financially able to not work or only work part time? I work a regular 40 hour job and Im still struggling to get by. I constantly want to quit my job but its just not possible, and that need overrides my depression. How do you make it work?",1,-0.5,2.099999905,0.036583386,0.480008543,0.380873501,0.062549062,0.039985552
386,"Anyone else having one of those days when you just can't quite see the point of it all?  I have thoughts about suicide from time to time, but I know I will never act on them.  Yes I'm on medication, and yes I'm getting therapy, but at 59 years old it just seems like there's not a lot of point to it all... Back in April I was hospitalized and they almost lost me on the operating table.  Sometimes I wish they had. But they didn't, and I won't kill myself, so that means I just gotta go on, and I'm really tired of it all.",1,-0.200000003,1.600000024,0.048325203,0.333143026,0.476784259,0.083179459,0.058568042
387,"....is fucking out of control!!! Been on Zoloft since I was 19 (more than a decade now) and I think it has wrecked my body in many ways.One of them is my memory. I actually forget items in my hand and where I've reached in gym reps! Does anyone suffer from this stuff?When my depression gets really bad I routinely pay for stuff, take my change and leave the item at the counter ",1,-0.300000012,1.899999976,0.117597513,0.305626601,0.161554009,0.396441996,0.018779784
388,"17y old female here, iv struggled with mdd and anxiety all my life, iv only recently as of 4 years ago been put on anti depressants and it worked up until these past few months. its hard for me to get out of bed even take showers and its dragging me down further into a hole i created for myself and im not sure how to go about getting better life is getting more challenging for me as i go. i feel as if  i wouldnt care if i died, not as in suicide or anything like that but that it just wouldnt matter to me if i did die,and i dont have very many healthy coping skills to deal with this feeling, any suggestions ab what to do would help, thank you.",1,0,0.899999976,0.003912749,0.295458227,0.642242491,0.033415612,0.024970923
389,I don't know how I would face people after if I failed. I would feel stupid.,1,-0.600000024,1.299999952,0.012585002,0.234115422,0.682249069,0.065629371,0.005421129
390,I don't feel alive and I don't feel human. Even with the medication everyday feels like a pre-calculated mess that I have zero control of. I don't feel like I'm living when my parents get to live through me. Why bother to exist. ,1,-0.400000006,1.899999976,0.017186476,0.17985116,0.440743774,0.345627338,0.016591275
391,"So I'm pretty brain dead being bounced around from doctors to doctor, and trying to remember what meds I've tried who has what and what dates and hospitals everyone who is no longer practicing was at so uhAnyone have tips how they track their meds, doctors and requests for referrals?",1,-0.5,0.5,0.008563053,0.446945012,0.511614859,0.028207444,0.004669701
392,"Im not good at anything, my wife hates me, my boss hates me, my friends dont want me around anymore because Im a downer, etc.",1,-0.899999976,0.899999976,0.016489515,0.288049161,0.526630998,0.129576311,0.039254088
393,"I had a major research paper due yesterday that was worth a third of my grade, and there was just no way I could finish it on time.  What I submitted wasn't a reflection of how much research I had done because I didn't have time to cite it all or arrange it into a logically flowing essay.  I couldn't have written anything coherent without first doing heaps of research because none of it was common sense.  I had an A in that course and I'm probably going to finish with a C.  I worked so hard all semester.  The time constraints for the larger assignments in that course were insane.  I spent so much miserable, sleep-deprived time on that course and this final blow is what it amounted to.I'm not privileged enough to not have a job.  My mom is too poor to help me pay for college.  Maybe taking other classes at the same time was a mistake, but I'm not psychic.  I don't understand why the due date couldn't have been next week, when classes actually end.  I feel guilty for resting over Thanksgiving break when I apparently should have kept my nose to the grindstone.  I shouldn't have cooked anything, I should have begged my mom to not invite my obnoxious uncle over, I should have spent every day that the library was open in the library- there was no real break, but I was too naive and burnt out from previous weeks to see that.  I actually did study over the break- just lightly, because I thought that was okay.I feel stupid and irresponsible.  I feel like I'm getting what I deserve.  People will always judge me as adjectives rather than circumstances.  I actually found the course extremely interesting, but I just couldn't keep up in the end.  Experiences like this lower my sense of self-efficacy.  They show me that success in life is largely out of my control.  The subject was central to my identity- it was about globalization and policy.  A C is what I'll have to show for it.  I could have written a stellar paper if I had just one more week, and I think we all deserve one more week because that's when most other finals happen and this assignment was a massive 12-15 page research paper on what we'd recommend to solve very large scale problems with no clear solutions. I wasted hours and hours researching how to reform American K-12 schools only to find that the poverty in some schools was driving down the average test scores of all of them.  The answer I found was preschool- nobody talks about that.  It isn't in the news.  All the talk is about funding and understaffing.  Apparently, the economic inequality in the US is so severe that it screws up poor kids for life, and excellent preschools give them the early stimulation that their parents can't give them.  How they perform in kindergarten compared to their wealthier peers actually predicts how likely they are to not graduate from high school, but nobody talks about that. It makes sense now, but it took me so long just to arrive at that solution.  I only had two weeks, counting Thanksgiving break, plus other classes, plus work, plus my crazy uncle, plus my car breaking down an hour away, and plus having to wake up too early to drive my mom to work because we're all sharing one car now. ",1,-0.200000003,12.30000019,0.020819703,0.33581233,0.125729069,0.507261872,0.01037699
394,"I asked a friend out yesterday. I had a huge crush on her. She said no. That was my only motivation for waking up and keeping my head busy. Not only do i suffer from depression but also anxiety. Right now it's all blank. I feel like nothing. I feel pathetic for letting her be a big part of my life. So what's next? Nobody knows. I wish i could know if things will get better or not, that way i could decide if this suffering is worth it.",1,0,2.799999952,0.059678055,0.351187229,0.060148239,0.272606403,0.256380081
395,"About 2 months ago i broke my knee in half and had to have surgery. While i was in the hospital i met this nurse, who id later fall in love with. I told her everything about me. We did MDMA together. I had been in relationships before but this was different. She was my favorite person, i was willing to put my life on hold to be with her. I wanted to join the military, and live on the coast. To me it wasn't my goal but my dream. I hate the mid-west. For her i decided i wasn't going to do that, instead id move down to bowling green, KY. The last place id ever see myself going or even want to go. But i would do it for her. Maybe we rushed things. But we really clicked that well. At least i thought we did.4 days ago she left her apple watch at my house and i found out she was still texting her ex. I told him immediately what was going on, how she was cheating. He did not know and was probably more hurt than me, they were together for 3.5 years. He had some idea but wasn't sure. Poor guy. I felt terrible. He even got her the apple watch. I was scarred to tell him honestly, i'm a small guy and he could kick my ass. Hell from what i heard about him i figured he would. But he appreciated me telling him. It was the least i could do. More than anything i wish it would have been the other way around. That i was the one been cheating on after 3.5 years instead of 2 months. It hurts me knowing i did that to someone. I cant imagine how bad it feels. If i was in his situation i may have killed myself.These past few days I've been drinking, taking hydrocodone, and etizolam non stop. Time feels like its been moving by differently. Almost faster. Its more bearable. I don't think i am suicidal, but I've been having these thoughts. That if something happens to me from all this i don't really care. The only thing that was stopped me from out right killing myself is my dog. Shes like my kid. I either get cheated on or left in every relationship I've been in. This feels like the final blow. Like this is the standard.She has been trying to text me, it feels like fucking harassment. I would block her and she would text me from a different number. I bet she is reading this considering she has my Reddit username. She keeps trying to justify it. Id like to know why, but i realized its not worth thinking about. The why does not really matter at the end of the day. It's just what it is. ",1,0,15.69999981,0.00339605,0.469974399,0.49518767,0.026777929,0.004663968
396,"Drunk and lonely, I really hate life. I just want everything to go away. No friends, never had a relationship, not close to family, and alcohol is my only escape. Why does everyone hate me?",1,-0.300000012,1.5,0.194559231,0.475273997,0.143353224,0.136491954,0.050321601
397,"So 29, non traditional student. Ive had depression, or what I assume it is, for as long as I can remember. Im finally getting health insurance in January thanks to the help of my family. I was on medication as a child for ADD through out most of my elementary school-junior year of high school then stopped. Ive had a huge aversion to medication since then. Now I know I need help, Im trying to be healthier, and trying to be better, but I feel like medication is the best option as therapy doesnt do much for me. Are there any suggestions, advice for what I should be looking for? I know there isnt a magic bullet that will make me a successful, joyous, happy, pain free individual. I just want to have motivation, I just want to have joy that I dont regret afterwards. Yeah thats all.",1,0.200000003,4.599999905,0.045477286,0.413690478,0.28930229,0.219451308,0.032078579
398,So a little background Im 20 years old Ive had job offers and things like that but for some damn reason I always talk myself out of actually going through because of fear. Recently I told myself Im going to apply to be a tutor at the college I go to and if I get the job 10/10 will not back out. I got the job I wanted and out of fear I talked myself out of it because idk what reason. At this point I honestly dont know what I should do because at this point its not even about the money its about I need to go out more. My question is should I go see the doctor and try to get some medicine? I know Im depressed but what it comes down to is I feel like I would be more happy/content if I went out more and had more money. Idk what to do at this point Im at a loss. ,1,-0.200000003,2.200000048,0.012950413,0.409539461,0.497614324,0.072874419,0.007021379
399,"Depressed for the last seven years without anyone noticing or caring,all i can feel now is hate,hate for being put in this shithole without any talent,looks or something that make this existence worthwhile,hate for others who i feel have everything that i lack,hate myself for falling in line and accepting it instead of opening a window and jump out.",1,-0.899999976,0.899999976,0.191267848,0.155876339,0.067692481,0.513742447,0.071420789
400,"After 9 months of hell at work and a week of praying, thinking and consulting a lot of people, I'm turning in my two weeks notice tonight, in just a few hours. I'm done with letting a retail job that will never help me at all in life get in the way of my mental and physical health. That place has overstayed it's welcome in my life, and I'm ready to fix all the damage it has done. I'll take a month off, and then in January, rock in the new year by job searching. Thankfully, my circumstances allow me to get well from my nervous breakdown long before I have to go back to work.It's time to take care of myself for once. ",1,0,2.599999905,0.019334383,0.131704509,0.705640793,0.137929857,0.005390476
401,"Anytime I try to vocalize my negative thoughts, they don't make sense. I can't make a full sentence out of them or convey those thoughts into a sentence. So basically, the thoughts aren't true, they just seem negative in my head. But then I get frustrated because I can't speak and idk what the fuck is going on. ",1,-0.300000012,1.5,0.286515534,0.258153141,0.280056715,0.145268858,0.030005692
402,"I get bad motion sickness. My entire childhood I would focus on faraway objects instead of the road. At 18 I wouldn't know how to give directions to my house even though it's like 5 miles. Didn't understand road signs or how to merge etc, just tried really hard not to puke. No one took the time to teach me, either. Yes, I've tried Dramamine. It's not even just the car that makes me sick, it's the flashing sunlight through the trees. Like a strobe light. Watching tv at night, and certain games do the same thing.The summer before last, I tried pot. Noticed it took the nausea away and I enjoyed car rides quite a bit. I could actually look and see what's going on around me. Got a bottle of CBD oil a few months ago so I wouldn't have to smoke every time I get in the car, works great. Felt inspired to finally learn how to drive. Failed my learners test twice in a row and got discouraged. I want to give it another go, right now, but it's so hard. I lack common sense when it comes to the road, I literally spent my entire life looking at the clouds, and I still can't give or understand directions when people ask me. My parents are just as useless as I am. My father is an actual homeless bum and my mother is a drug addict who gave up custody of me when I was 6. I grew up in multiple households and was never really taught how to do many basic things. I do have a sister, but we don't know each other very well and she already has her hands full with her 7 children. I know how unbelievable this sounds, and I'm not even sharing the other tragedies in my childhood but please just believe me.My husband has been taking care of me since I was 18. We have three children. He has PTSD and is rated 100% disabled by the VA. He gets benefits that put a roof over our heads and pay our major bills. He does not work, because it puts too much pressure on him and it worsens his condition. Which means I have to work, and I'm happy to, but I can't drive. He does not have the patience to teach me. I completely rely on him for everything. I've lost several jobs for lateness, because he is very slow in the morning. I want to say it's not his fault, but he stays up until 2am playing video games and chatting up girls on okcupid. I started a new job recently and love it, but we got into a fight yesterday because we were running late (he wouldn't get out of bed) and he wanted me to eat before going into work. I told him there was no time and I don't want to get fired, but he pulled into a McDonald's drive thru anyway. I had time to eat half a hash brown before he parked in front of my work and he got angry when I gave the rest of the food to him. He doesn't understand how to prioritize some things. I ended up getting a warning from my boss. I have no friends, because he always ends up trying to fuck them (he is a serial cheater). He's even invited two of his female friends to live with us, both without asking me how I felt about it. He doesnt want to go on dates with me, even if it's free. Our sex life is a joke. His idea of foreplay is wiggling his cock in my face or saying, ""Gimme some."" He doesn't give me orgasms and doesn't understand why I'm no longer enthusiastic about getting on my knees for him. He will get angry with me and treat me like shit if I deny him. After I do what he wants, he goes back to his games and talking to girls. He falls asleep on the couch most nights, just passes out wherever he is.I don't talk to anyone or go anywhere. I have zero friends, really. I don't even make eye contact with other men my age. I've fantasized about having a license, leaving him, getting my own place and entering the dating scene. I'm often told by people that I'm pretty, but they don't know how hideous my stretch marks are from having three c-sections. If I were to meet a man, I wouldn't be able to undress in front of him. Yeah yeah guys don't care about stretch marks, sure. But I will still feel inferior to other women, it will feel like I'm a downgrade and I would feel sorry for whoever gets stuck with me. I'm alone but I want to escape. My husband's family has money, if I were to leave, he'd win custody of our children because I wouldn't have a stable place for them to live. I try to look past his faults because I know how worthless I am, and I have faults of my own, but it's getting harder. I just really want to die, I've tried getting help and they put me in the hospital for two days, twisted around everything I said and acted like I was an actual threat to myself, and sent me home with a prescription. My husband got tired of taking me to therapy after the second session.I'm really tired, I love my children but I can't even drive them to a fucking doctors appointment. I love my job, but whenever my coworkers ask me questions about myself or want to chit chat, I have nothing to say. I don't know why I'm even posting here, I doubt I'll follow through with any advice. I don't know what else to say, so I'll just submit this post. Sorry for the jumbled mess, thanks in advance to whoever reads this. Please don't link me to a suicide hotline. I'm not going to kill myself. ",1,-0.100000001,28.29999924,0.024345784,0.299746394,0.600199938,0.072395705,0.003312263
403,"Any hobby I put an interest in, it doesn't matter which, I can never get good at it. I've tried guitar, piano, harmonica, and I can learn the basics but when I get to advanced subjects I get stuck on them and can't muster the motivation to continue. I gave up on learning Japanese because I can't sit down and practice it every day, so when I do try I'm back to step 1 since I forgot everything. I can't stay committed to an exercise routine for more than a few days. I'm awful at drawing and painting. I can't commit to completing a single programming project. I want to be good at something. There's so many things that interest me and I just wish I could fucking stick to one and get good at it. But I can't. I always give up and I hate myself for it. ",1,-0.200000003,4,0.040553421,0.213179424,0.503992975,0.217361793,0.02491237
404,"The fear is hitting me hard that my fiancee is planning to move out of town. With or without me. I told her I don't want to move away from the city we live in, but my opinion doesn't seem to matter and she's still looking for a place. Plus friends are coming to me on her plans, and she doesn't seem to want to talk to me about them.My relationship at best is currently unstable.I'm currently on her Welfare file as a dependant meaning all the money comes in under her name, so I got nothing to pay for to fight for my daughter.It feels like her family hates me if they are putting this idea in her ear as she's out of town with them currently.I don't want to get friends in the middle of this, it's not their fight/problem. But I need to talk with more people about it to figure out what I'm going to try to do.",1,0,1.600000024,0.108301811,0.281992793,0.448051214,0.146356225,0.015297972
405,"im 22, i live with my parents. i have a part time job but other than that i really just play video games and spend time with my boyfriend. i woke up this morning and went downstairs and my mom decided to have this big talk with me about how if im unhappy with my life i need to do things to change it and im not working towards any goals. except ! i am ! im not happy with my job and even though im not looking for a new one now theres reason for that! im gonna be a keyholder soon, which looks good on a resume and it also looks bad for me to have 3 jobs all lasting less than a year so im waiting stuff out for my resume to look better. then she told me i need to take a break. but thats not how life works? you cant just take a break from everything? especially when you have a job and even if you could it doesnt matter! because as soon as that breaks over youre going back to the same shit that made you unhappy in the first place! and im just wasting my life away playing video games in my room and talking to people on the internet but i need to find real friends that i can go out and do things with but i dont even LIKE going out and maybe i should go back to school but that sounds like a mental breakdown waiting to happen because its been that way literally every other time ive tried to go back to school and idk im ranting now im just super annoyed with everything right nowTL;DR: dont try to tell people what they need to do with their life when theyre already trying their best to get things done ",1,-0.200000003,5.5,0.066427022,0.4522416,0.263744026,0.155633077,0.06195429
406,I just wanted to share it with you. I'm no doctor but it really worked for me.,1,0.300000012,0.699999988,0.012110964,0.647157669,0.26303196,0.068922147,0.00877721
407,"I know this probably sounds crazy, but sometimes I fantasize talking to someone about my depression because Ive never opened up to anyone about it before and I wish I could.",1,-0.200000003,0.200000003,0.071145728,0.128234118,0.648261786,0.037784424,0.114573881
408,"Like on YouTube, Facebook, Discord, etc...?",1,0.100000001,0.100000001,0.030521004,0.656374991,0.17898795,0.052963138,0.081152871
409,"Today was going quite well. I was quite productive till around 4 pm. Now I feel so low and worthless. My friends were seated near me doing a course project and they were talking about going to a bar. It wasnt that they completely ignored me. Every now and then I would jump into the conversation. But theyve now left and they didnt even ask if I wanted to come. Im sure they didnt mean to ignore me, they just thought I was busy. Still it kind of hurts that none of them even asked. I always say yes when people ask me to come with them for dinner or drinks or a movie because its pretty rare. It makes me so happy to know that someone thought of me for a moment. When they dont think of me when Im right in front of them, it sucks. ",1,-0.100000001,6,0.130292401,0.559004903,0.092589401,0.124335468,0.093777835
